{
  "statements": [
    {
      "statement_type": "BALANCE_SHEET",
      "title_en": "Statement of Financial Position",
      "title_ar": "قائمة المركز المالي",
      "start_page": 1,
      "end_page": 1,
      "table_ids": [
        "t1"
      ],
      "columns": [
        {
          "index": 2,
          "fiscal_year": 2025,
          "period_type": "ANNUAL",
          "header_text": "كما في 31 ديسمبر 2025 م"
        },
        {
          "index": 3,
          "fiscal_year": 2024,
          "period_type": "ANNUAL",
          "header_text": "كما في 31 ديسمبر 2024 م"
        }
      ]
    },
    {
      "statement_type": "INCOME_STATEMENT",
      "title_en": "Statement of Profit or Loss and Other Comprehensive Income",
      "title_ar": "قائمة الدخل والدخل الشامل الآخر",
      "start_page": 2,
      "end_page": 2,
      "table_ids": [
        "t1"
      ],
      "columns": [
        {
          "index": 2,
          "fiscal_year": 2025,
          "period_type": "ANNUAL",
          "header_text": "كما في 31 ديسمبر 2025 م"
        },
        {
          "index": 3,
          "fiscal_year": 2024,
          "period_type": "ANNUAL",
          "header_text": "كما في 31 ديسمبر 2024 م"
        }
      ]
    },
    {
      "statement_type": "CHANGES_IN_EQUITY",
      "title_en": "Statement of Changes in Equity",
      "title_ar": "قائمة التغير في حقوق الملكية",
      "start_page": 3,
      "end_page": 3,
      "table_ids": [
        "t1"
      ],
      "columns": []
    },
    {
      "statement_type": "CASH_FLOW",
      "title_en": "Statement of Cash Flows",
      "title_ar": "قائمة التدفقات النقدية",
      "start_page": 4,
      "end_page": 4,
      "table_ids": [
        "t1"
      ],
      "columns": [
        {
          "index": 1,
          "fiscal_year": 2025,
          "period_type": "ANNUAL",
          "header_text": "كما في 31 ديسمبر 2025 م"
        },
        {
          "index": 2,
          "fiscal_year": 2024,
          "period_type": "ANNUAL",
          "header_text": "كما في 31 ديسمبر 2024 م"
        }
      ]
    }
  ],
  "notes_section": {
    "start_page": null,
    "end_page": null,
    "table_ids": []
  },
  "segmentation_confidence": 0.95,
  "issues": [
    "Table ID 't1' is reused for all statements in the provided OCR data.",
    "Notes section not explicitly identified in the provided table list."
  ]
}