{
  "statements": [
    {
      "statement_type": "BALANCE_SHEET",
      "title_en": "Statement of Financial Position",
      "title_ar": "قائمة المركز المالي",
      "start_page": 1,
      "end_page": 1,
      "table_ids": [
        "t1"
      ],
      "columns": [
        {
          "index": 2,
          "fiscal_year": 2024,
          "period_type": "ANNUAL",
          "header_text": "٢٠٢٤م"
        }
      ]
    },
    {
      "statement_type": "INCOME_STATEMENT",
      "title_en": "Statement of Profit or Loss and Other Comprehensive Income",
      "title_ar": "قائمة الربح أو الخسارة والدخل الشامل الآخر",
      "start_page": 2,
      "end_page": 2,
      "table_ids": [
        "t1"
      ],
      "columns": [
        {
          "index": 2,
          "fiscal_year": 2024,
          "period_type": "ANNUAL",
          "header_text": "٢٠٢٤م"
        }
      ]
    },
    {
      "statement_type": "CHANGES_IN_EQUITY",
      "title_en": "Statement of Changes in Equity",
      "title_ar": "قائمة التغيرات في حقوق الشركاء",
      "start_page": 3,
      "end_page": 3,
      "table_ids": [
        "t1"
      ],
      "columns": []
    },
    {
      "statement_type": "CASH_FLOW",
      "title_en": "Statement of Cash Flows",
      "title_ar": "قائمة التدفقات النقدية",
      "start_page": 4,
      "end_page": 4,
      "table_ids": [
        "t1"
      ],
      "columns": [
        {
          "index": 2,
          "fiscal_year": 2024,
          "period_type": "ANNUAL",
          "header_text": "٢٠٢٤م"
        }
      ]
    }
  ],
  "notes_section": {
    "start_page": null,
    "end_page": null,
    "table_ids": []
  },
  "segmentation_confidence": 0.95,
  "issues": [
    "Duplicate table_id 't1' provided for all tables in the source data.",
    "Notes to Financial Statements section not found in the provided OCR table list."
  ]
}