{
  "statements": [
    {
      "statement_type": "BALANCE_SHEET",
      "title_en": "Statement of Financial Position",
      "title_ar": "قائمة المركز المالي",
      "start_page": 1,
      "end_page": 1,
      "table_ids": [
        "t1"
      ],
      "columns": [
        {
          "index": 2,
          "fiscal_year": 2025,
          "period_type": "ANNUAL",
          "header_text": "٢٠٢٥م"
        },
        {
          "index": 3,
          "fiscal_year": 2024,
          "period_type": "ANNUAL",
          "header_text": "٢٠٢٤م"
        }
      ]
    },
    {
      "statement_type": "INCOME_STATEMENT",
      "title_en": "Statement of Profit or Loss and Other Comprehensive Income",
      "title_ar": "قائمة الربح أو(الخسارة) و الدخل الشامل الاخر",
      "start_page": 2,
      "end_page": 2,
      "table_ids": [
        "t1"
      ],
      "columns": [
        {
          "index": 2,
          "fiscal_year": 2025,
          "period_type": "ANNUAL",
          "header_text": "٢٠٢٥م"
        },
        {
          "index": 3,
          "fiscal_year": 2024,
          "period_type": "ANNUAL",
          "header_text": "٢٠٢٤م"
        }
      ]
    },
    {
      "statement_type": "CHANGES_IN_EQUITY",
      "title_en": "Statement of Changes in Equity",
      "title_ar": "قائمة التغير في حقوق الملكية",
      "start_page": 3,
      "end_page": 3,
      "table_ids": [
        "t1",
        "t2"
      ],
      "columns": [
        {
          "index": 0,
          "fiscal_year": 2024,
          "period_type": "ANNUAL",
          "header_text": "قائمة التغير في حقوق الملكية - ٢٠٢٤م"
        },
        {
          "index": 0,
          "fiscal_year": 2025,
          "period_type": "ANNUAL",
          "header_text": "قائمة التغير في حقوق الملكية - ٢٠٢٥م"
        }
      ]
    },
    {
      "statement_type": "CASH_FLOW",
      "title_en": "Statement of Cash Flows",
      "title_ar": "قائمة التدفق النقدي",
      "start_page": 4,
      "end_page": 4,
      "table_ids": [
        "t1"
      ],
      "columns": [
        {
          "index": 1,
          "fiscal_year": 2025,
          "period_type": "ANNUAL",
          "header_text": "٢٠٢٥ م"
        },
        {
          "index": 2,
          "fiscal_year": 2024,
          "period_type": "ANNUAL",
          "header_text": "٢٠٢٤ م"
        }
      ]
    }
  ],
  "notes_section": null,
  "segmentation_confidence": 0.85,
  "issues": [
    "Duplicate table_id 't1' used for multiple distinct tables across different pages in source data.",
    "Notes section not explicitly identified in the provided OCR data snippet."
  ]
}